budget,genres,homepage,id,keywords,original_language,original_title,overview,popularity,production_companies,production_countries,release_date,revenue,runtime,spoken_languages,status,tagline,title,vote_average,vote_count
75000000,"[{""id"": 18, ""name"": ""Drama""}, {""id"": 878, ""name"": ""Science Fiction""}, {""id"": 53, ""name"": ""Thriller""}]",,2900,"[{""id"": 1157, ""name"": ""wife husband relationship""}, {""id"": 3801, ""name"": ""space travel""}, {""id"": 9882, ""name"": ""space""}, {""id"": 10364, ""name"": ""mission""}, {""id"": 13149, ""name"": ""pregnancy""}, {""id"": 14626, ""name"": ""astronaut""}]",en,The Astronaut's Wife,"When astronaut Spencer Armacost returns to Earth after a mission that nearly cost him his life, he decides to take a desk job in order to see his beautiful wife, Jillian, more often. Gradually, Jillian notices that Spencer's personality seems to have changed, but her concerns fade when she discovers that she's pregnant. As Jillian grows closer to becoming a mother, her suspicions about Spencer return. Why does it seem as if he's a different person?",20.697556,"[{""name"": ""New Line Cinema"", ""id"": 12}, {""name"": ""Mad Chance"", ""id"": 1757}]","[{""iso_3166_1"": ""US"", ""name"": ""United States of America""}]",1999-08-26,19598588,109.0,"[{""iso_639_1"": ""en"", ""name"": ""English""}]",Released,How well do you know the one you love?,The Astronaut's Wife,5.4,254
0,"[{""id"": 18, ""name"": ""Drama""}]",,259943,"[{""id"": 2692, ""name"": ""arranged marriage""}, {""id"": 181962, ""name"": ""labor camp""}]",zh,归来,Lu and Feng are a devoted couple forced to separate when Lu is arrested and sent to a labor camp as a political prisoner during the Cultural Revolution. He finally returns home only to find that his beloved wife no longer remembers him.,6.017273,"[{""name"": ""LeVision Pictures"", ""id"": 20966}]","[{""iso_3166_1"": ""CN"", ""name"": ""China""}]",2014-05-16,0,111.0,"[{""iso_639_1"": ""zh"", ""name"": ""\u666e\u901a\u8bdd""}]",Released,,Coming Home,6.9,49
130000000,"[{""id"": 878, ""name"": ""Science Fiction""}, {""id"": 28, ""name"": ""Action""}, {""id"": 12, ""name"": ""Adventure""}]",,82700,"[{""id"": 4565, ""name"": ""dystopia""}]",en,After Earth,"One thousand years after cataclysmic events forced humanity's escape from Earth, Nova Prime has become mankind's new home. Legendary General Cypher Raige returns from an extended tour of duty to his estranged family, ready to be a father to his 13-year-old son, Kitai. When an asteroid storm damages Cypher and Kitai's craft, they crash-land on a now unfamiliar and dangerous Earth. As his father lies dying in the cockpit, Kitai must trek across the hostile terrain to recover their rescue beacon. His whole life, Kitai has wanted nothing more than to be a soldier like his father. Today, he gets his chance.",42.840582,"[{""name"": ""Columbia Pictures"", ""id"": 5}, {""name"": ""Blinding Edge Pictures"", ""id"": 12236}, {""name"": ""Overbrook Entertainment"", ""id"": 12485}]","[{""iso_3166_1"": ""US"", ""name"": ""United States of America""}]",2013-05-30,243843127,100.0,"[{""iso_639_1"": ""en"", ""name"": ""English""}]",Released,"Danger is real, fear is a choice",After Earth,5.0,2532
10000000,"[{""id"": 18, ""name"": ""Drama""}]",,103731,"[{""id"": 1261, ""name"": ""river""}, {""id"": 1585, ""name"": ""snake""}, {""id"": 5521, ""name"": ""arkansas""}, {""id"": 10718, ""name"": ""fugitive""}, {""id"": 158244, ""name"": ""river boat""}]",en,Mud,Two teenage boys encounter a fugitive and make a pact to help him escape from an island in the Mississippi.,17.663353,"[{""name"": ""FilmNation Entertainment"", ""id"": 7493}, {""name"": ""Everest Entertainment"", ""id"": 10892}]","[{""iso_3166_1"": ""US"", ""name"": ""United States of America""}]",2013-05-01,21587700,130.0,"[{""iso_639_1"": ""en"", ""name"": ""English""}]",Released,,Mud,7.0,1068
0,"[{""id"": 18, ""name"": ""Drama""}, {""id"": 10749, ""name"": ""Romance""}]",,12509,"[{""id"": 2679, ""name"": ""artist""}, {""id"": 3836, ""name"": ""success""}, {""id"": 5625, ""name"": ""relationship problems""}, {""id"": 7464, ""name"": ""alcoholism""}, {""id"": 10183, ""name"": ""independent film""}, {""id"": 13072, ""name"": ""falling in love""}]",en,Pollock,"In August of 1949, Life Magazine ran a banner headline that begged the question: ""Jackson Pollock: Is he the greatest living painter in the United States?"" The film is a look back into the life of an extraordinary man, a man who has fittingly been called ""an artist dedicated to concealment, a celebrity who nobody knew."" As he struggled with self-doubt, engaging in a lonely tug-of-war between needing to express himself and wanting to shut the world out, Pollock began a downward spiral.",8.483531,"[{""name"": ""Fred Berner Films"", ""id"": 89312}, {""name"": ""Zeke Productions"", ""id"": 89425}]","[{""iso_3166_1"": ""US"", ""name"": ""United States of America""}]",2000-09-06,0,122.0,"[{""iso_639_1"": ""en"", ""name"": ""English""}]",Released,A true portrait of life and art.,Pollock,6.6,91
0,"[{""id"": 10752, ""name"": ""War""}, {""id"": 18, ""name"": ""Drama""}, {""id"": 36, ""name"": ""History""}]",,281230,"[{""id"": 187056, ""name"": ""woman director""}]",en,Fort McCoy,"Unable to serve in World War II because of a heart condition, a barber moves his family adjacent to a Wisconsin army base and prisoner-of-war camp to provide his services. But even in rural America -- far from the frontline -- the war finds victims.",0.384496,[],[],2014-01-01,0,0.0,[],Released,,Fort McCoy,6.3,2
35000000,"[{""id"": 35, ""name"": ""Comedy""}, {""id"": 10751, ""name"": ""Family""}]",,15189,"[{""id"": 2393, ""name"": ""adoption""}, {""id"": 8841, ""name"": ""puppy""}, {""id"": 12341, ""name"": ""pitbull""}, {""id"": 13014, ""name"": ""orphan""}, {""id"": 158394, ""name"": ""foster home""}, {""id"": 158395, ""name"": ""animal lover""}, {""id"": 158415, ""name"": ""beagle""}, {""id"": 179431, ""name"": ""duringcreditsstinger""}]",en,Hotel for Dogs,"Placed in a foster home that doesn't allow pets, 16-year-old Andi and her younger brother, Bruce, turn an abandoned hotel into a home for their dog. Soon other strays arrive, and the hotel becomes a haven for every orphaned canine in town. But the kids have to do some quick thinking to keep the cops off their tails.",13.25753,"[{""name"": ""DreamWorks SKG"", ""id"": 27}, {""name"": ""Nickelodeon Movies"", ""id"": 2348}]","[{""iso_3166_1"": ""US"", ""name"": ""United States of America""}]",2009-01-16,73034460,100.0,"[{""iso_639_1"": ""en"", ""name"": ""English""}]",Released,No stray gets turned away.,Hotel for Dogs,5.7,202
30000000,"[{""id"": 16, ""name"": ""Animation""}, {""id"": 35, ""name"": ""Comedy""}, {""id"": 10751, ""name"": ""Family""}]",http://toystory.disney.com/toy-story,862,"[{""id"": 931, ""name"": ""jealousy""}, {""id"": 4290, ""name"": ""toy""}, {""id"": 5202, ""name"": ""boy""}, {""id"": 6054, ""name"": ""friendship""}, {""id"": 9713, ""name"": ""friends""}, {""id"": 9823, ""name"": ""rivalry""}, {""id"": 165503, ""name"": ""boy next door""}, {""id"": 170722, ""name"": ""new toy""}, {""id"": 187065, ""name"": ""toy comes to life""}]",en,Toy Story,"Led by Woody, Andy's toys live happily in his room until Andy's birthday brings Buzz Lightyear onto the scene. Afraid of losing his place in Andy's heart, Woody plots against Buzz. But when circumstances separate Buzz and Woody from their owner, the duo eventually learns to put aside their differences.",73.640445,"[{""name"": ""Pixar Animation Studios"", ""id"": 3}]","[{""iso_3166_1"": ""US"", ""name"": ""United States of America""}]",1995-10-30,373554033,81.0,"[{""iso_639_1"": ""en"", ""name"": ""English""}]",Released,,Toy Story,7.7,5269
